{
  "schema": "radar-source-validation/v1",
  "generated_at": "2026-09-21T22:03:32.870856+00:00",
  "status": "ok",
  "counts": {
    "sources": 82,
    "healthy": 82,
    "failed": 0,
    "baseline_verified": 82,
    "baseline_pending": 0
  },
  "sources": [
    {
      "source_id": "source.anthropic.news",
      "module_id": "source.anthropic.news",
      "module_name": "Anthropic News",
      "task_ids": [
        "task.source.anthropic.news.sync"
      ],
      "adapter": "html_collection",
      "locator": "https://www.anthropic.com/news",
      "enabled": true,
      "schedule": {
        "enabled": true,
        "timezone": "Asia/Shanghai",
        "cron": "17 * * * *"
      },
      "status": "ok",
      "health": {
        "adapter": "html_collection",
        "status": "healthy",
        "message": "html_collection connector ready",
        "network": true,
        "details": {}
      },
      "checked_at": "2026-09-21T22:03:32.842972+00:00",
      "latency_ms": 3,
      "baseline_status": "verified",
      "cursor_status": "present",
      "live": {
        "enabled": false,
        "discovered": 0,
        "fetched": 0,
        "checked_at": "2026-09-21T22:03:32.842972+00:00",
        "latency_ms": 3
      },
      "errors": [],
      "baseline_fingerprint": "418ce711aa2bfa8aa750eb80f90b58aa3a147c3b701d28d734e78a6eb612b4f8",
      "cursor_run_id": "run-20260921T220047Z-68b13e9e"
    },
    {
      "source_id": "source.chip-huyen.blog",
      "module_id": "source.chip-huyen.blog",
      "module_name": "Chip Huyen",
      "task_ids": [
        "task.source.chip-huyen.blog.sync"
      ],
      "adapter": "rss",
      "locator": "https://huyenchip.com/feed.xml",
      "enabled": true,
      "schedule": {
        "enabled": true,
        "timezone": "Asia/Shanghai",
        "cron": "17 * * * *"
      },
      "status": "ok",
      "health": {
        "adapter": "rss",
        "status": "healthy",
        "message": "rss connector ready",
        "network": true,
        "details": {}
      },
      "checked_at": "2026-09-21T22:03:32.847030+00:00",
      "latency_ms": 13,
      "baseline_status": "verified",
      "cursor_status": "present",
      "live": {
        "enabled": false,
        "discovered": 0,
        "fetched": 0,
        "checked_at": "2026-09-21T22:03:32.847030+00:00",
        "latency_ms": 13
      },
      "errors": [],
      "baseline_fingerprint": "6e9a91dea7d15b25d1c24b0dbd691c3a65131b63339984825959d05815666d45",
      "cursor_run_id": "run-20260921T220047Z-68b13e9e"
    },
    {
      "source_id": "source.deepmind.blog",
      "module_id": "source.deepmind.blog",
      "module_name": "Google DeepMind Blog",
      "task_ids": [
        "task.source.deepmind.blog.sync"
      ],
      "adapter": "rss",
      "locator": "https://deepmind.google/blog/rss.xml",
      "enabled": true,
      "schedule": {
        "enabled": true,
        "timezone": "Asia/Shanghai",
        "cron": "17 * * * *"
      },
      "status": "ok",
      "health": {
        "adapter": "rss",
        "status": "healthy",
        "message": "rss connector ready",
        "network": true,
        "details": {}
      },
      "checked_at": "2026-09-21T22:03:32.860373+00:00",
      "latency_ms": 0,
      "baseline_status": "verified",
      "cursor_status": "present",
      "live": {
        "enabled": false,
        "discovered": 0,
        "fetched": 0,
        "checked_at": "2026-09-21T22:03:32.860373+00:00",
        "latency_ms": 0
      },
      "errors": [],
      "baseline_fingerprint": "d47d10b93d20521273d11679f5b6658c2a5e4d9be6a93cff06d13f77c8449505",
      "cursor_run_id": "run-20260921T220047Z-68b13e9e"
    },
    {
      "source_id": "source.eugene-yan.blog",
      "module_id": "source.eugene-yan.blog",
      "module_name": "Eugene Yan",
      "task_ids": [
        "task.source.eugene-yan.blog.sync"
      ],
      "adapter": "rss",
      "locator": "https://eugeneyan.com/rss/",
      "enabled": true,
      "schedule": {
        "enabled": true,
        "timezone": "Asia/Shanghai",
        "cron": "17 * * * *"
      },
      "status": "ok",
      "health": {
        "adapter": "rss",
        "status": "healthy",
        "message": "rss connector ready",
        "network": true,
        "details": {}
      },
      "checked_at": "2026-09-21T22:03:32.860515+00:00",
      "latency_ms": 0,
      "baseline_status": "verified",
      "cursor_status": "present",
      "live": {
        "enabled": false,
        "discovered": 0,
        "fetched": 0,
        "checked_at": "2026-09-21T22:03:32.860515+00:00",
        "latency_ms": 0
      },
      "errors": [],
      "baseline_fingerprint": "57e60d64c5b744e442b5c75f0302b74569defa193702263d037f729ec8200fba",
      "cursor_run_id": "run-20260921T220047Z-68b13e9e"
    },
    {
      "source_id": "source.google.research",
      "module_id": "source.google.research",
      "module_name": "Google Research Blog",
      "task_ids": [
        "task.source.google.research.sync"
      ],
      "adapter": "rss",
      "locator": "https://research.google/blog/rss/",
      "enabled": true,
      "schedule": {
        "enabled": true,
        "timezone": "Asia/Shanghai",
        "cron": "17 * * * *"
      },
      "status": "ok",
      "health": {
        "adapter": "rss",
        "status": "healthy",
        "message": "rss connector ready",
        "network": true,
        "details": {}
      },
      "checked_at": "2026-09-21T22:03:32.860595+00:00",
      "latency_ms": 0,
      "baseline_status": "verified",
      "cursor_status": "present",
      "live": {
        "enabled": false,
        "discovered": 0,
        "fetched": 0,
        "checked_at": "2026-09-21T22:03:32.860595+00:00",
        "latency_ms": 0
      },
      "errors": [],
      "baseline_fingerprint": "5c7a636884a1965a697dc416470328ea46495b8a58575c66500ac924dac34346",
      "cursor_run_id": "run-20260921T220047Z-68b13e9e"
    },
    {
      "source_id": "source.hamel.blog",
      "module_id": "source.hamel.blog",
      "module_name": "Hamel Husain",
      "task_ids": [
        "task.source.hamel.blog.sync"
      ],
      "adapter": "rss",
      "locator": "https://hamel.dev/index.xml",
      "enabled": true,
      "schedule": {
        "enabled": true,
        "timezone": "Asia/Shanghai",
        "cron": "17 * * * *"
      },
      "status": "ok",
      "health": {
        "adapter": "rss",
        "status": "healthy",
        "message": "rss connector ready",
        "network": true,
        "details": {}
      },
      "checked_at": "2026-09-21T22:03:32.860663+00:00",
      "latency_ms": 0,
      "baseline_status": "verified",
      "cursor_status": "present",
      "live": {
        "enabled": false,
        "discovered": 0,
        "fetched": 0,
        "checked_at": "2026-09-21T22:03:32.860663+00:00",
        "latency_ms": 0
      },
      "errors": [],
      "baseline_fingerprint": "1f498dca8138cca91bfa1a778f9764b833d4a80544b4e1bde65e5bb35167594d",
      "cursor_run_id": "run-20260921T220047Z-68b13e9e"
    },
    {
      "source_id": "source.huggingface.blog",
      "module_id": "source.huggingface.blog",
      "module_name": "Hugging Face Blog",
      "task_ids": [
        "task.source.huggingface.blog.sync"
      ],
      "adapter": "rss",
      "locator": "https://huggingface.co/blog/feed.xml",
      "enabled": true,
      "schedule": {
        "enabled": true,
        "timezone": "Asia/Shanghai",
        "cron": "17 * * * *"
      },
      "status": "ok",
      "health": {
        "adapter": "rss",
        "status": "healthy",
        "message": "rss connector ready",
        "network": true,
        "details": {}
      },
      "checked_at": "2026-09-21T22:03:32.860821+00:00",
      "latency_ms": 0,
      "baseline_status": "verified",
      "cursor_status": "present",
      "live": {
        "enabled": false,
        "discovered": 0,
        "fetched": 0,
        "checked_at": "2026-09-21T22:03:32.860821+00:00",
        "latency_ms": 0
      },
      "errors": [],
      "baseline_fingerprint": "2b997b4f0e064bd64aaf4cdd750c7ab424689eb8a0bd1c8b7259544c21993f01",
      "cursor_run_id": "run-20260921T220047Z-68b13e9e"
    },
    {
      "source_id": "source.interconnects.blog",
      "module_id": "source.interconnects.blog",
      "module_name": "Interconnects",
      "task_ids": [
        "task.source.interconnects.blog.sync"
      ],
      "adapter": "rss",
      "locator": "https://www.interconnects.ai/feed",
      "enabled": true,
      "schedule": {
        "enabled": true,
        "timezone": "Asia/Shanghai",
        "cron": "17 * * * *"
      },
      "status": "ok",
      "health": {
        "adapter": "rss",
        "status": "healthy",
        "message": "rss connector ready",
        "network": true,
        "details": {}
      },
      "checked_at": "2026-09-21T22:03:32.860896+00:00",
      "latency_ms": 0,
      "baseline_status": "verified",
      "cursor_status": "present",
      "live": {
        "enabled": false,
        "discovered": 0,
        "fetched": 0,
        "checked_at": "2026-09-21T22:03:32.860896+00:00",
        "latency_ms": 0
      },
      "errors": [],
      "baseline_fingerprint": "11adb3d60dbc3665ba56968c377975bd293743a386b6209614b2f2e7314a3f79",
      "cursor_run_id": "run-20260921T220047Z-68b13e9e"
    },
    {
      "source_id": "source.jxnl.blog",
      "module_id": "source.jxnl.blog",
      "module_name": "Jason Liu",
      "task_ids": [
        "task.source.jxnl.blog.sync"
      ],
      "adapter": "rss",
      "locator": "https://jxnl.co/feed_rss_created.xml",
      "enabled": true,
      "schedule": {
        "enabled": true,
        "timezone": "Asia/Shanghai",
        "cron": "17 * * * *"
      },
      "status": "ok",
      "health": {
        "adapter": "rss",
        "status": "healthy",
        "message": "rss connector ready",
        "network": true,
        "details": {}
      },
      "checked_at": "2026-09-21T22:03:32.860984+00:00",